{
  "$schema": "https://json-schema.org/draft/2020-12/schema",
  "$id": "harness_retro.schema.json",
  "title": "contracts/harness/retro/<YYYYMMDD>.json -- one pass of the meta-harness loop",
  "description": "One pass, written by the harness seat once a day and again after each bench visit (the person's settlement of 2026-10-16, item b). It says what was read and over which window, so the next pass knows where to start and a reader can tell 'nothing happened' from 'nothing was looked at'. The tree line is copied from the validator's last line with its digest, because a bare run is nobody's commit. Counts here are read off the record and say how, under 8.3 rule 6. landed_today is the list the day's report to the person is built from, each with its revert command. If a pass after a bench visit falls on a day that already has a pass, it goes in <YYYYMMDD>-<n>.json.",
  "type": "object",
  "properties": {
    "artifact": { "const": "harness_retro" },
    "schema_version": { "const": "0.1" },
    "seat": { "type": "string", "pattern": "^[a-z]+(-[a-z0-9]+)*$" },
    "on": { "type": "string", "pattern": "^[0-9]{4}-[0-9]{2}-[0-9]{2}$" },
    "trigger": { "enum": ["daily", "bench_visit"] },
    "bench_visit": { "type": "string", "description": "For trigger bench_visit: the commit or run that records the visit." },
    "tree": { "type": "string", "minLength": 10, "description": "The validator's tree line for this pass, digest included." },
    "verdict": { "type": "string", "description": "The validator's verdict line, verbatim." },
    "observed": {
      "type": "array",
      "minItems": 1,
      "items": {
        "type": "object",
        "properties": {
          "source": { "type": "string", "description": "What was read: a failures.jsonl, the query log, commit messages, the gate's record, the commit tool's record." },
          "path": { "type": ["string", "null"] },
          "window": { "type": "string", "description": "From when to when, or which commits." },
          "found": { "type": "string", "description": "What was found, with the count and the method that produced it." }
        },
        "required": ["source", "path", "window", "found"],
        "additionalProperties": false
      }
    },
    "new_incidents": { "type": "array", "items": { "$ref": "harness_incident.schema.json#/$defs/incident_id" } },
    "measured": {
      "type": "array",
      "description": "8.3 loop step 7: for each class whose answer has landed, whether it recurred since, counted off the record.",
      "items": {
        "type": "object",
        "properties": {
          "class": { "type": "string" },
          "since": { "type": "string", "description": "The landing commit." },
          "recurrences": { "type": "integer", "minimum": 0 },
          "method": { "type": "string", "minLength": 10 }
        },
        "required": ["class", "since", "recurrences", "method"],
        "additionalProperties": false
      }
    },
    "proposals": {
      "type": "array",
      "items": {
        "type": "object",
        "properties": {
          "id": { "type": "string", "pattern": "^HP-[0-9]{3}$" },
          "this_pass": { "type": "string", "minLength": 5 }
        },
        "required": ["id", "this_pass"],
        "additionalProperties": false
      }
    },
    "landed_today": {
      "type": "array",
      "items": {
        "type": "object",
        "properties": {
          "proposal": { "type": "string", "pattern": "^HP-[0-9]{3}$" },
          "kind": { "enum": ["tighten", "loosen", "reshape", "retire"] },
          "commit": { "type": "string", "pattern": "^[0-9a-f]{7,40}$" },
          "revert_command": { "type": "string", "minLength": 5 }
        },
        "required": ["proposal", "kind", "commit", "revert_command"],
        "additionalProperties": false
      }
    },
    "next": { "type": "array", "items": { "type": "string" } }
  },
  "required": ["artifact", "schema_version", "seat", "on", "trigger", "tree", "verdict", "observed", "new_incidents", "measured", "proposals", "landed_today", "next"],
  "additionalProperties": false,
  "allOf": [
    { "if": { "properties": { "trigger": { "const": "bench_visit" } } }, "then": { "required": ["bench_visit"] } }
  ]
}
